l abbaye,"0,00 €",0,10,"0,00","(hotel de l abbaye lyon, hotel abbaye lyon, hotel l abbaye lyon)"
chez,"1,31 €",3,10,"0,00","(chez pilo lyon, chambre à louer chez l habitant lyon, hébergement chez l habitant lyon)"
social,"0,59 €",1,10,"0,00",(hotel social lyon)
atypique,"0,61 €",1,10,"0,00","(hotel atypique lyon, hotel atypique rhone alpes, logement atypique lyon)"
auberges,"1,54 €",2,10,"0,00","(auberges de jeunesse lyon, auberges a lyon, auberges de jeunesses lyon)"
groupe,"0,72 €",1,10,"0,00","(hebergement groupe lyon, groupe hotelier lyon, logement groupe lyon)"
pierre,"1,41 €",2,9,"0,00","(hôtel première classe lyon pierre bénite, prix hôtel première classe lyon pierre bénite, hotel pierre benite lyon)"
rhône,"0,61 €",1,9,"0,00","(logis de france rhône alpes, week end en amoureux avec jacuzzi privatif rhône alpes, hôtel avec piscine intérieure rhône alpes)"
proximité,"0,00 €",0,9,"0,00","(hotel a proximité de la gare lyon part dieu, hôtel pas cher proximité gare lyon part dieu, groupama stadium hotel a proximité)"
près,"0,66 €",1,9,"0,00","(weekend en amoureux près de lyon, hotel lyon près de la gare part dieu, hotel près de gare de lyon)"
tour,"0,00 €",0,9,"0,00","(hotel tour rose lyon, tour crayon lyon hotel, hotel tour crayon lyon)"
journee lyon,"0,67 €",1,9,"0,00","(hotel journee lyon, chambre a la journee lyon, hotel a la journee lyon)"
hilton,"0,00 €",0,9,"0,00","(hotel saint priest hilton, hilton eurexpo, hilton hotel lyon)"
campanile,"0,00 €",0,9,"0,00","(campanile hotel lyon, hotel campanile 69003 lyon, hotel campanile bron)"
cours,"1,22 €",2,9,"0,00","(cours des loges lyon, b&b hotel cours gambetta lyon, belle cours lyon)"
soie,"0,00 €",0,9,"0,00","(hotel vaulx en velin la soie, hotel carre de soie, ibis carre de soie lyon)"
okko,"0,00 €",0,9,"0,00","(okko hotel lyon, hotel lyon okko, okko hotel lyon parking)"
louer,"0,00 €",0,9,"0,00","(louer une chambre dans un couvent lyon, chambre a louer lyon, chambre à louer chez l habitant lyon)"
residence,"0,00 €",0,9,"0,00","(hotel residence lyon, hotel la residence lyon bellecour, residence hotel lyon)"
mercure,"0,65 €",1,9,"0,00","(hotel lyon mercure, hotel mercure charbonnieres lyon, hotel mercure de lyon)"
location,"1,24 €",2,9,"0,00","(location nuit lyon, location appart city lyon, location appartement journée lyon)"
normandie lyon,"0,00 €",0,9,"0,00","(hotel de normandie lyon, hotel normandie lyon)"
place,"0,00 €",0,9,"0,00","(2 place francisque régaud 69002 lyon, hotel ibis place bellecour lyon, hotel place bellecour lyon)"
trivago,"0,57 €",1,8,"0,00","(trivago hotel lyon, trivago lyon, hotel lyon trivago)"
styles lyon,"0,00 €",0,8,"0,00","(prix ibis styles lyon croix rousse, ibis styles lyon centre gare part dieu, prix hôtel ibis styles lyon villeurbanne)"
cheap,"0,78 €",2,8,"0,00","(cheap hotel in lyon, cheap accommodation lyon, cheap hostel lyon)"
groupon,"0,00 €",0,8,"0,00","(groupon hotel lyon, groupon lyon hotel, hotel lyon groupon)"
palace,"0,00 €",0,8,"0,00","(hotel palace lyon, hotel quick palace saint priest, palace a lyon)"
grey,"2,04 €",3,8,"0,00",(chambre 50 nuances de grey lyon)
centro,"1,49 €",2,8,"0,00","(hotel centro lyon, hotel en lyon centro, hotel lione centro)"
genis laval,"1,83 €",3,8,"0,00","(hotel saint genis laval, hôtel kyriad lyon sud saint genis laval, hotel saint genis laval pas cher)"
corbas,"0,54 €",1,8,"0,00","(appart hotel corbas, cris hotel corbas, hotel corbas)"
bar,"0,00 €",0,8,"0,00","(bar burger lyon, bar hotel dieu lyon, hotel dieu bar lyon)"
pension,"0,65 €",1,8,"0,00","(hotel demi pension lyon, hotel pension lyon, pension a lyon)"
lumière,"0,58 €",1,8,"0,00","(lagrange apart hôtel lyon lumière avis, hotel lyon monplaisir lumière, lagrange apart hotel lyon lumière lyon)"
victoria,"0,60 €",1,8,"0,00","(hotel le victoria lyon, hotel victoria lyon, hotel victoria lyon avis)"
entre,"0,00 €",0,8,"0,00","(hotel entre lyon et chambery, hotel entre lyon et grenoble, hotel entre dijon et lyon)"
alter,"0,00 €",0,8,"0,00","(alter hostel lyon, alter hostel, alter hotel lyon)"
etap hotel,"0,62 €",1,8,"0,00","(etap hotel lyon, etap hotel chaponnay, etap hotel lyon france)"
carlton,"0,73 €",1,8,"0,00","(carlton hotel lyon, avis sur hotel carlton lyon, carlton lyon)"
50,"2,04 €",3,8,"0,00",(chambre 50 nuances de grey lyon)
nuances,"2,04 €",3,8,"0,00",(chambre 50 nuances de grey lyon)
et cuire,"0,00 €",0,8,"0,00","(hotel caluire et cuire, hôtel caluire et cuire, hotel caluire et cuire ibis)"
bon plan,"0,46 €",1,8,"0,00","(bon plan hotel lyon, bon plan logement lyon, hotel bon plan lyon)"
francia,"0,75 €",1,8,"0,00","(hotel ibis lyon francia, hotel lyon francia, hospedaje en lyon francia)"
3ème arrondissement,"0,00 €",0,8,"0,00","(hotels lyon 3ème arrondissement, hotel lyon 3ème arrondissement pas cher, appart hôtel lyon 3ème arrondissement)"
richelieu lyon,"0,69 €",1,7,"0,00","(hotel boutique richelieu lyon, hotel le richelieu lyon, hôtel boutique richelieu lyon gare part dieu)"
monplaisir,"0,00 €",0,7,"0,00","(hotel lyon 8 monplaisir, b&b hotel lyon centre monplaisir avis, hotel lyon centre monplaisir)"
propos,"1,87 €",3,7,"0,00",(pilo hôtel à propos)
arena lyon,"0,00 €",0,7,"0,00","(hotel proche ldlc arena lyon, hotel ldlc arena lyon, hotel arena lyon)"
vue,"0,00 €",0,7,"0,00","(hotel avec vue lyon, hotel vue sur lyon, hotel lyon vue panoramique)"
tony garnier,"0,65 €",1,7,"0,00","(hotel pres de la halle tony garnier lyon, halle tony garnier hotel, hotel halle tony garnier)"
24 24,"0,00 €",0,7,"0,00","(hotel 24 24 lyon, hotel lyon ouvert 24 24, hotel lyon reception 24 24)"
a43,"0,66 €",1,7,"0,00","(hotel a43 lyon, hotel autoroute a43, hotel proche autoroute a43)"
halle,"0,65 €",1,7,"0,00","(hotel pres de la halle tony garnier lyon, halle tony garnier hotel, hotel halle tony garnier)"
mihotel,"0,74 €",1,7,"0,00","(mihotel, mihotel lyon avis, hotel mihotel lyon)"
barlou burger,"0,00 €",0,7,"0,00","(barlou burger lyon, barlou burger lyon adresse, barlou burger lyon part dieu)"
