Mot,Coût,Clics ,Impressions,Conversions,Principales requêtes contenant ce mot
lyon,"744,45 €",1 219,8 914,"0,00","(pilo lyon, hotel lyon, auberge de jeunesse lyon)"
hotel,"327,19 €",602,4 968,"0,00","(hotel lyon, pilo hotel lyon, pilo hotel)"
pilo,"376,53 €",765,1 928,"0,00","(pilo lyon, pilo hotel lyon, pilo hotel)"
cher,"115,03 €",176,1 177,"0,00","(hotel lyon pas cher, hotel pas cher lyon, hôtel pas cher lyon 20 euros)"
pas,"109,90 €",168,1 171,"0,00","(hotel lyon pas cher, hotel pas cher lyon, hôtel pas cher lyon 20 euros)"
de,"78,38 €",112,963,"0,00","(auberge de jeunesse lyon, meilleur burger de lyon, auberge de jeunesse lyon pas cher)"
burger,"56,04 €",61,911,"0,00","(smash burger lyon, meilleur burger lyon, burger lyon)"
hôtel,"80,06 €",140,910,"0,00","(pilo hôtel, hôtel pas cher lyon 20 euros, hôtel lyon)"
auberge,"63,05 €",93,569,"0,00","(auberge de jeunesse lyon, auberge jeunesse lyon, auberge de jeunesse lyon pas cher)"
jeunesse,"58,61 €",88,538,"0,00","(auberge de jeunesse lyon, auberge jeunesse lyon, auberge de jeunesse lyon pas cher)"
a,"27,76 €",42,367,"0,00","(hotel a lyon, hotel a lyon pas cher, hotel pas cher a lyon)"
dieu,"14,55 €",22,324,"0,00","(hotel dieu lyon, grand hotel dieu lyon, ibis lyon part dieu)"
ibis,"13,31 €",20,269,"0,00","(ibis lyon part dieu, ibis budget lyon, hôtel ibis lyon)"
meilleur,"30,84 €",33,263,"0,00","(meilleur burger lyon, meilleur burger de lyon, meilleur smash burger lyon)"
part dieu,"12,37 €",19,251,"0,00","(ibis lyon part dieu, hotel lyon part dieu pas cher, hotel pas cher lyon part dieu)"
hostel,"27,42 €",45,243,"0,00","(hostel lyon, pilo hostel, pilo lyon hostel)"
centre,"16,08 €",23,242,"0,00","(hotel lyon centre, hostel lyon centre, auberge de jeunesse lyon centre)"
smash,"14,00 €",15,220,"0,00","(smash burger lyon, meilleur smash burger lyon, smash burger)"
chambre,"14,70 €",23,208,"0,00","(chambre d hote lyon, chambre avec jacuzzi privatif lyon pas cher, chambre 50 nuances de grey lyon)"
prix,"25,08 €",44,186,"0,00","(prix pilo hôtel, prix pullman lyon, pilo hôtel prix)"
à,"16,61 €",28,185,"0,00","(hôtel pas cher à lyon, hôtel à lyon, hotel à l heure lyon)"
gare,"6,12 €",9,182,"0,00","(hotel gare de lyon, hotel pas cher gare de lyon, hotel proche gare de lyon)"
spa,"7,06 €",11,149,"0,00","(hotel avec spa lyon, spa privatif lyon couple journée, hotel lyon spa)"
la,"5,44 €",9,140,"0,00","(hotel rillieux la pape, la cour des loges lyon, hotel a cote de la gare lyon part dieu)"
avec,"4,99 €",8,140,"0,00","(hotel avec spa lyon, chambre avec jacuzzi privatif lyon pas cher, hotel avec piscine lyon)"
jacuzzi,"11,59 €",18,137,"0,00","(hotel jacuzzi lyon, chambre avec jacuzzi privatif lyon pas cher, hotel jacuzzi privatif lyon)"
d,"8,84 €",13,135,"0,00","(chambre d hote lyon, chambre d hotes lyon, chambre d hôtes lyon)"
1,"8,78 €",14,130,"0,00","(formule 1 lyon, hotel lyon pas cher 1 nuit, formule 1 hotel lyon)"
saint,"7,73 €",12,113,"0,00","(hotel aeroport saint exupery, hotel lyon saint exupery, hotel saint priest)"
privatif,"6,84 €",11,113,"0,00","(spa privatif lyon couple journée, chambre avec jacuzzi privatif lyon pas cher, hotel jacuzzi privatif lyon)"
restaurant,"5,27 €",8,110,"0,00","(restaurant burger lyon, hotel restaurant lyon, meilleur restaurant burger lyon)"
nuit,"7,79 €",12,106,"0,00","(nuit insolite lyon, hotel lyon pas cher 1 nuit, nuit romantique lyon jacuzzi privatif)"
villeurbanne,"9,67 €",13,101,"0,00","(hotel villeurbanne, hotel pas cher villeurbanne, hôtel villeurbanne)"
love,"5,05 €",8,101,"0,00","(love hotel lyon, love room lyon, love room lyon pas cher)"
formule 1,"6,25 €",10,100,"0,00","(formule 1 lyon, formule 1 hotel lyon, hôtel formule 1 lyon part dieu)"
croix,"5,57 €",11,97,"0,00","(pilo croix rousse, hotel lyon croix rousse, hotel croix rousse)"
le,"9,90 €",16,97,"0,00","(le pilo lyon, hotel le moins cher lyon, le flâneur guesthouse lyon)"
croix rousse,"5,57 €",11,96,"0,00","(pilo croix rousse, hotel lyon croix rousse, hotel croix rousse)"
en,"5,53 €",8,93,"0,00","(hotel vaulx en velin, hôtel pour une journée en amoureux lyon, nuit insolite en amoureux lyon)"
hotels,"8,56 €",16,88,"0,00","(pilo hotels, hotels lyon, pilo hotels lyon)"
appart,"5,40 €",8,87,"0,00","(appart hôtel lyon pas cher, appart city lyon, appart hotel lyon centre)"
proche,"2,08 €",3,87,"0,00","(hotel proche gare de lyon, hotel proche groupama stadium lyon, hôtel après lyon proche autoroute)"
perrache,"4,01 €",6,83,"0,00","(hotel lyon perrache, hotel perrache, hôtel pas cher lyon perrache)"
amoureux,"4,54 €",7,82,"0,00","(hôtel spa lyon amoureux, hôtel pour une journée en amoureux lyon, week end à lyon amoureux)"
burgers,"9,75 €",11,82,"0,00","(meilleurs burgers lyon, burgers lyon, les meilleurs burgers de lyon)"
ville,"5,83 €",9,75,"0,00","(hotel lyon centre ville, hotel de ville lyon, hôtel pas cher à lyon centre ville)"
budget,"5,02 €",8,74,"0,00","(ibis budget lyon, hotel lyon ibis budget, hotel ibis budget lyon)"
les,"4,64 €",6,73,"0,00","(les meilleurs burgers de lyon, chambre d hote sainte foy les lyon, hotel sainte foy les lyon)"
insolite,"7,68 €",12,73,"0,00","(nuit insolite lyon, hotel insolite lyon, logement insolite lyon)"
des,"3,90 €",6,72,"0,00","(cour des loges lyon, la cour des loges lyon, hotel cour des loges lyon)"
meilleurs,"9,11 €",10,71,"0,00","(meilleurs burgers lyon, les meilleurs burgers de lyon, meilleurs burger lyon)"
piscine,"3,27 €",5,68,"0,00","(hotel avec piscine lyon, hotel piscine intérieure lyon, hotel piscine lyon)"
vieux,"4,27 €",6,68,"0,00","(hotel vieux lyon, auberge de jeunesse vieux lyon, hostel vieux lyon)"
week end,"2,09 €",3,64,"0,00","(week end à lyon amoureux, week end lyon amoureux, week end amoureux lyon)"
l,"3,08 €",4,62,"0,00","(hotel à l heure lyon, hotel a l heure lyon, hotel de l abbaye lyon)"
dormir,"5,59 €",9,62,"0,00","(ou dormir a lyon, dormir pas cher a lyon, dormir a lyon)"
20,"6,95 €",11,61,"0,00","(hôtel pas cher lyon 20 euros, hostel 20 lyon, hotel 20 euros lyon)"
20 euros,"6,95 €",11,60,"0,00","(hôtel pas cher lyon 20 euros, hotel 20 euros lyon)"
stadium,"1,97 €",3,60,"0,00","(hotel groupama stadium, hotel proche groupama stadium lyon, hotel lyon groupama stadium)"
groupama,"1,97 €",3,59,"0,00","(hotel groupama stadium, hotel proche groupama stadium lyon, hotel lyon groupama stadium)"
classe,"4,37 €",7,53,"0,00","(hôtel première classe lyon, hotel premiere classe lyon, hôtel première classe à lyon)"
hote,"3,55 €",5,53,"0,00","(chambre d hote lyon, chambre d hote sainte foy les lyon, chambre hote lyon)"
romantique,"3,32 €",5,52,"0,00","(hotel romantique lyon, nuit romantique lyon jacuzzi privatif, hôtel romantique lyon)"
room,"1,84 €",3,51,"0,00","(love room lyon, love room lyon pas cher, love room lyon journée)"
3,"0,66 €",1,50,"0,00","(hotel lyon 3, auberge de jeunesse lyon 3, hotel lyon 3 pas cher)"
b&b,"1,93 €",3,50,"0,00","(b&b hotel lyon, b&b lyon, hôtel b&b lyon)"
hébergement,"3,99 €",6,49,"0,00","(hébergement lyon pas cher, hébergement lyon, hébergement lyon gratuit)"
f1,"4,60 €",7,47,"0,00","(hotel f1 lyon, hotel f1 a lyon, f1 lyon)"
journée,"3,73 €",6,46,"0,00","(spa privatif lyon couple journée, spa privatif lyon journée, hotel journée lyon)"
moins cher,"8,18 €",13,44,"0,00","(hotel moins cher lyon, hotel lyon moins cher, hôtel moins cher à lyon)"
avis,"2,74 €",5,43,"0,00","(pilo hôtel avis, hotel premiere classe tassin la demi lune avis, hotel vaubecour lyon avis)"
du,"3,00 €",4,43,"0,00","(hotel du helder lyon, hotel du theatre lyon, hotel du parc lyon)"
et,"0,00 €",0,43,"0,00","(nuit et spa lyon, burger et bagels lyon, hotel caluire et cuire)"
priest,"2,43 €",4,43,"0,00","(hotel saint priest, hotel saint priest lyon, hôtel formule 1 saint priest)"
ou,"4,59 €",7,43,"0,00","(ou dormir a lyon, ou sejourner a lyon, ou dormir à lyon pas cher)"
pilot,"7,57 €",13,40,"0,00","(hotel pilot lyon, pilot hotel lyon)"
arrondissement,"2,59 €",4,40,"0,00","(hotel lyon 1er arrondissement, hotel lyon 2ème arrondissement, hotel lyon 6ème arrondissement pas cher)"
sur,"1,93 €",3,40,"0,00","(hotel sur lyon, hôtel sur lyon, burger sur lyon)"
exupery,"2,84 €",4,40,"0,00","(hotel aeroport saint exupery, hotel lyon saint exupery, hotel pres de l aeroport de lyon saint exupery)"
radisson,"0,67 €",1,38,"0,00","(hotel radisson lyon, radisson blu hotel lyon, prix radisson blu hotel lyon)"
france,"1,59 €",2,38,"0,00","(auberge de jeunesse lyon france, chambre d hotes lyon gites de france, hostel lyon france)"
chere,"1,79 €",3,37,"0,00","(hotel pas chere lyon, hotel lyon pas chere, hotel pas chere a lyon)"
charme,"0,00 €",0,37,"0,00","(hotel de charme lyon, hotel charme lyon, hotel de charme lyon centre)"
ruck,"1,70 €",3,37,"0,00","(ruck hotel lyon, the ruck hotel lyon, prix the ruck hotel)"
7,"0,87 €",1,36,"0,00","(hotel lyon 7, bill's burger lyon 7, auberge de jeunesse lyon 7)"
loges,"1,23 €",2,35,"0,00","(cour des loges lyon, la cour des loges lyon, hotel cour des loges lyon)"
pullman,"0,58 €",1,35,"0,00","(prix pullman lyon, hotel pullman lyon, pullman hotel lyon)"
bellecour,"1,99 €",3,35,"0,00","(prix sofitel lyon bellecour, hotel bellecour, hotel bellecour lyon pas cher)"
grand,"0,00 €",0,34,"0,00","(grand hotel dieu lyon, grand hotel lyon, le grand refectoire lyon)"
aeroport,"1,99 €",3,34,"0,00","(hotel aeroport saint exupery, hotel vers aeroport lyon, hotel pres de l aeroport de lyon saint exupery)"
hamburger,"3,23 €",4,33,"0,00","(hamburger lyon, meilleur hamburger lyon, hamburger halal lyon)"
luxe,"0,60 €",1,33,"0,00","(hôtel lyon luxe, hôtel de luxe lyon, hotel lyon luxe)"
8,"0,82 €",1,32,"0,00","(hotel lyon 8, smash and beef lyon 8, smash burger lyon 8)"
cour,"1,23 €",2,31,"0,00","(cour des loges lyon, la cour des loges lyon, hotel cour des loges lyon)"
confluence,"1,54 €",2,31,"0,00","(hotel confluence lyon, hotel lyon confluence, hotel lyon confluence pas cher)"
pres,"1,25 €",2,31,"0,00","(hotel a lyon pres de la gare, hotel pres de l aeroport de lyon saint exupery, hotel pres de la halle tony garnier lyon)"
parking,"0,67 €",1,31,"0,00","(hotel avec parking lyon, hotel lyon centre avec parking, hotel lyon avec parking)"
aéroport,"0,00 €",0,31,"0,00","(hotel aéroport lyon pas cher, hotel aéroport lyon navette gratuite, b b hotel lyon aéroport saint exupéry)"
menu,"3,41 €",4,31,"0,00","(burger addict lyon menu, bill's burger lyon 6 menu, burger addict lyon 3 menu)"
lione,"1,23 €",2,31,"0,00","(dove dormire a lione, hotel lione, b&b hotel lione)"
livraison,"4,60 €",5,30,"0,00","(livraison burger lyon, burger livraison lyon, burger lyon livraison)"
dayuse lyon,"0,76 €",1,30,"0,00","(dayuse lyon, hotel dayuse lyon)"
meyzieu,"1,29 €",2,29,"0,00","(hotel meyzieu pas cher, hotel meyzieu, bb hotel meyzieu)"
hebergement,"2,01 €",3,29,"0,00","(hebergement lyon, hebergement groupe lyon, hebergement insolite lyon)"
5,"1,66 €",2,28,"0,00","(hotel 5 etoiles lyon, hôtel 5 étoiles lyon, hotel lyon 5 etoiles)"
appartement,"1,20 €",2,28,"0,00","(appartement jacuzzi lyon, appartement hotel lyon, appartement hotel lyon pas cher)"
rue,"0,67 €",1,28,"0,00","(hotel b b lyon 9 rue antoine lumiere, hotel rue victor hugo lyon, 10 12 rue elisée reclus 69600 oullins france)"
première classe,"3,05 €",5,28,"0,00","(hôtel première classe lyon, hôtel première classe à lyon, hôtel première classe lyon pierre bénite)"
en velin,"2,81 €",4,28,"0,00","(hotel vaulx en velin, hôtel vaulx en velin pas cher, hotel vaulx en velin la soie)"
vaulx en,"2,81 €",4,28,"0,00","(hotel vaulx en velin, hôtel vaulx en velin pas cher, hotel vaulx en velin la soie)"
slo,"1,35 €",2,28,"0,00","(slo lyon saxe, slo hostel lyon, slo lyon les pentes)"
etoiles,"1,42 €",2,28,"0,00","(hotel 4 etoiles lyon, hotel 5 etoiles lyon, hotel lyon 5 etoiles)"
venissieux,"0,00 €",0,27,"0,00","(hotel venissieux, formule 1 lyon venissieux, hotel a venissieux)"
logement,"4,59 €",7,26,"0,00","(logement insolite lyon, bon plan logement lyon, logement atypique lyon)"
maison,"2,15 €",3,26,"0,00","(maison d hôtes lyon, burger fait maison lyon, burger maison lyon)"
bron,"1,78 €",3,26,"0,00","(hotel bron, hotel bron pas cher, bron hotel)"
2,"0,67 €",1,25,"0,00","(hotel lyon 2, burger lyon 2, restaurant burger lyon 2)"
couple,"3,70 €",6,25,"0,00","(spa privatif lyon couple journée, hotel couple lyon, hotel lyon couple)"
villa,"1,20 €",2,25,"0,00","(villa florentine lyon, villa maia lyon, la villa florentine)"
piscine intérieure,"1,23 €",2,24,"0,00","(hotel piscine intérieure lyon, hotel lyon piscine intérieure, hotel avec piscine intérieure lyon)"
halal,"1,86 €",2,24,"0,00","(smash burger lyon halal, burger halal lyon, meilleur burger halal lyon)"
and,"0,85 €",1,24,"0,00","(bed and breakfast lyon, burger and bagel lyon, smash and beef lyon 8)"
hôtels,"3,28 €",5,24,"0,00","(hôtels lyon, hôtels à lyon, hôtels pas chers lyon)"
d hotes,"1,39 €",2,24,"0,00","(chambre d hotes lyon, chambre d hotes lyon centre ville, chambre d hotes lyon gites de france)"
pillow,"5,74 €",10,23,"0,00","(pillow hotel lyon, pillow lyon)"
bb,"0,62 €",1,23,"0,00","(bb hotel lyon, bb hotel villeurbanne, bb hotel meyzieu)"
alpes,"0,00 €",0,23,"0,00","(hotel atypique rhone alpes, hotel jacuzzi privatif rhone alpes, logis de france rhône alpes)"
sud,"0,87 €",1,23,"0,00","(hotel lyon sud, hôtel kyriad lyon sud saint genis laval, prix hôtel f1 lyon sud oullins)"
autour,"2,32 €",4,22,"0,00","(auberge de jeunesse autour de moi, hotel autour de la gare de lyon part dieu, chambre d hote autour de lyon)"
rhone,"0,66 €",1,22,"0,00","(hotel atypique rhone alpes, hotel chasse sur rhone, hotel jacuzzi privatif rhone alpes)"
yasi,"3,13 €",4,22,"0,00","(yasi hostel lyon, prix yasi hostel, yasi hotel lyon)"
oullins,"2,23 €",3,21,"0,00","(hotel oullins, hotel oullins pas cher, hotel a oullins 69)"
lyon 9,"0,57 €",1,21,"0,00","(hotel lyon 9, hotel lyon 9 pas cher, hotel b b lyon 9 rue antoine lumiere)"
sofitel,"0,75 €",1,21,"0,00","(hotel sofitel lyon, prix sofitel lyon bellecour, sofitel lyon bellecour avis)"
autoroute,"1,24 €",2,21,"0,00","(hôtel après lyon proche autoroute, hotel lyon autoroute, hôtel sur autoroute a6 vers lyon)"
metropole,"0,62 €",1,21,"0,00","(hotel metropole lyon, hotel de la metropole lyon, hotel le metropole lyon)"
4,"0,66 €",1,20,"0,00","(hotel 4 etoiles lyon, hotel lyon 4 personnes, hotel 4 * lyon)"
pour,"1,22 €",2,20,"0,00","(hôtel pour une journée en amoureux lyon, dormir a lyon pour pas cher, hotel pour enfant lyon)"
radisson blu,"0,00 €",0,20,"0,00","(radisson blu hotel lyon, prix radisson blu hotel lyon, radisson blu bar lyon)"
jour lyon,"0,75 €",1,20,"0,00","(hotel de jour lyon, hôtel de jour lyon, chambre de jour lyon)"
lyo,"0,00 €",0,20,"0,00","(lyo hotel lyon, hotel lyo lyon, lyo hotel)"
motel,"0,66 €",1,19,"0,00","(motel lyon, lyon motel, bio motel lyon)"
city,"0,57 €",1,19,"0,00","(appart city lyon, appart city classic lyon part dieu villette, city trip lyon)"
papa,"0,87 €",1,19,"0,00","(burger de papa lyon, burger papa lyon, les burgers de papa lyon)"
heure lyon,"0,64 €",1,19,"0,00","(hotel à l heure lyon, hotel a l heure lyon, chambre a l heure lyon)"
dortoir lyon,"2,10 €",4,19,"0,00","(dortoir lyon pas cher, dortoir lyon)"
bon,"1,31 €",2,19,"0,00","(bon burger lyon, bon plan hotel lyon, bon plan logement lyon)"
tassin,"1,31 €",2,18,"0,00","(hotel premiere classe tassin la demi lune avis, hotel tassin la demi lune, hotel a tassin la demi lune)"
caluire,"0,00 €",0,18,"0,00","(hotel caluire et cuire, hotel caluire, hôtel caluire et cuire)"
suite,"0,47 €",1,18,"0,00","(park and suite lyon, private suite spa lyon, suite luxe lyon)"
tribe,"0,00 €",0,18,"0,00","(hotel tribe lyon, tribe hotel lyon, hotel tribe lyon croix rousse)"
the ruck,"0,36 €",1,18,"0,00","(the ruck hotel lyon, prix the ruck hotel, avis sur the ruck hotel)"
boscolo,"0,00 €",0,18,"0,00","(hotel boscolo lyon, hotel lyon boscolo, boscolo hotel lyon)"
best,"2,26 €",3,18,"0,00","(best burger in lyon, best western créqui lyon part dieu, best burger lyon)"
fourviere,"0,64 €",1,17,"0,00","(fourviere hotel lyon, hotel fourviere, hotel fourviere lyon)"
rillieux,"1,77 €",3,17,"0,00","(hotel rillieux la pape, hotel ibis rillieux la pape, hôtel à rillieux la pape)"
kyriad,"1,40 €",2,17,"0,00","(hôtel kyriad lyon sud saint genis laval, kyriad hotel lyon, kyriad prestige saint priest restaurant)"
au,"1,94 €",3,17,"0,00","(hotel au mois lyon, hotel au coeur de lyon, logement au mois lyon)"
gerland,"2,52 €",4,17,"0,00","(hotel lyon 7 gerland, ibis budget lyon gerland lyon, appart city confort lyon gerland appart hôtel)"
premiere classe,"1,32 €",2,17,"0,00","(hotel premiere classe lyon, hotel premiere classe tassin la demi lune avis, premiere classe hotel lyon)"
crayon lyon,"0,00 €",0,17,"0,00","(hotel crayon lyon, crayon lyon hotel, hotel le crayon lyon)"
helder,"0,00 €",0,17,"0,00","(hotel du helder lyon, hotel helder lyon, hôtel du helder lyon)"
demi,"1,31 €",2,17,"0,00","(hotel demi pension lyon, hotel premiere classe tassin la demi lune avis, hotel tassin la demi lune)"
five,"0,00 €",0,17,"0,00","(five burger lyon, five guys lyon menu, five guys menu lyon)"
villa florentine,"1,20 €",2,16,"0,00","(villa florentine lyon, la villa florentine, hotel villa florentine lyon)"
burgouzz,"0,00 €",0,16,"0,00",(burgouzz lyon)
d or,"0,75 €",1,16,"0,00","(hotel la tete d or lyon, hotel parc de la tete d or, hotel parc tete d or lyon)"
junk,"0,00 €",0,16,"0,00","(junk smash burger lyon, junk burger lyon)"
2023,"1,75 €",2,16,"0,00",(meilleur burger lyon 2023)
une,"1,21 €",2,16,"0,00","(hôtel pour une journée en amoureux lyon, louer une chambre dans un couvent lyon, dormir sur une péniche lyon)"
boutique,"0,69 €",1,16,"0,00","(boutique hotel lyon, hotel boutique richelieu lyon, boutique hôtel lyon)"
sans,"0,00 €",0,15,"0,00","(burger sans gluten lyon, hotel sans reception lyon, hotel sans souci lyon)"
chassieu,"1,42 €",2,15,"0,00","(hotel pas cher chassieu, hôtel chassieu eurexpo, best western chassieu lyon)"
beynost,"0,74 €",1,15,"0,00","(hotel beynost ibis, beynost hotel, hotel formule 1 beynost)"
givors,"1,27 €",2,15,"0,00","(hôtel givors pas cher, hotel givors, hotel givors pas cher)"
gratuit,"1,31 €",2,15,"0,00","(hébergement lyon gratuit, hotel lyon avec parking gratuit, hébergement gratuit lyon)"
un,"0,85 €",1,15,"0,00","(louer une chambre dans un couvent lyon, ou manger un bon burger a lyon, passer un week end a lyon)"
dans,"0,61 €",1,15,"0,00","(louer une chambre dans un couvent lyon, hotel dans le vieux lyon, chambre d hote dans le vieux lyon)"
la pape,"1,10 €",2,15,"0,00","(hotel rillieux la pape, hotel ibis rillieux la pape, hôtel à rillieux la pape)"
staycation lyon,"0,00 €",0,15,"0,00","(staycation lyon, staycation lyon avis)"
demi lune,"1,31 €",2,14,"0,00","(hotel premiere classe tassin la demi lune avis, hotel tassin la demi lune, hotel a tassin la demi lune)"
hoteles,"0,74 €",1,14,"0,00","(hoteles en lyon, hoteles lyon, hoteles ibis en lyon)"
est,"1,40 €",2,14,"0,00","(hotel lyon est, prix ibis budget lyon est beynost, adonis lyon est hôtel artys saint priest)"
ecully,"0,00 €",0,14,"0,00","(hotel a ecully, hotel ecully, hotel ecully pas cher)"
novotel,"0,00 €",0,14,"0,00","(novotel lyon, novotel lyon centre, hotel dardilly novotel)"
chromatics,"0,00 €",0,14,"0,00","(chromatics hotel lyon, prix hotel chromatics, hotel chromatics lyon)"
vers,"0,62 €",1,14,"0,00","(hotel vers aeroport lyon, hotel vers groupama stadium, hotel vers lyon)"
métropole,"0,66 €",1,14,"0,00","(lyon métropole hotel, prix hôtel lyon métropole by arteloge, hôtel lyon métropole & spa tarif)"
relais,"0,66 €",1,14,"0,00","(relais chateau lyon, hotel relais chateau lyon, lyon relais et chateaux)"
in lyon,"0,78 €",2,14,"0,00","(best burger in lyon, cheap hotel in lyon, hotel in lyon france)"
mob,"1,50 €",2,14,"0,00","(mob hotel lyon, hotel mob lyon, mob hotel bar lyon)"
&,"0,67 €",1,13,"0,00","(hôtel lyon métropole & spa tarif, spa & chill lyon, bed & breakfast lyon)"
vénissieux,"0,66 €",1,13,"0,00","(hotel vénissieux, hôtel vénissieux pas cher, hôtel vénissieux ibis)"
vaise,"0,62 €",1,13,"0,00","(hotel vaise, hotel vaise pas cher, appart city lyon vaise)"
parc,"0,75 €",1,13,"0,00","(hotel du parc lyon, hotel parc de la tete d or, hotel parc tete d or lyon)"
gluten,"0,00 €",0,13,"0,00",(burger sans gluten lyon)
hôtes lyon,"1,21 €",2,13,"0,00","(chambre d hôtes lyon, chambres d hôtes lyon, maison d hôtes lyon)"
69,"0,61 €",1,13,"0,00","(hotel a oullins 69, hotel grigny 69, hotel à givors 69)"
peniche,"0,00 €",0,13,"0,00","(peniche hotel lyon, dormir peniche lyon, hotel peniche lyon)"
6,"0,82 €",1,12,"0,00","(bill's burger lyon 6 menu, hotel lyon 6, hotel pas cher lyon 6)"
sainte foy,"0,00 €",0,12,"0,00","(chambre d hote sainte foy les lyon, hotel sainte foy les lyon, domaine saint joseph à sainte foy les lyon)"
hotelf1,"0,00 €",0,12,"0,00","(hotelf1 lyon, hotelf1 à villeurbanne, hotelf1 lyon 8ème états unis vénissieux)"
loger,"1,38 €",2,12,"0,00","(ou loger a lyon, ou loger a lyon pour la fete des lumieres, ou loger a lyon pour un week end)"
royal,"0,00 €",0,12,"0,00","(hotel royal lyon, hotel le royal lyon, hotel royal place bellecour lyon)"
saxe,"0,00 €",0,12,"0,00","(slo lyon saxe, burger saxe gambetta, hotel mercure saxe lafayette)"
gambetta,"0,00 €",0,12,"0,00","(b&b hotel lyon centre part dieu gambetta, b&b hôtel lyon centre part dieu gambetta telephone, burger saxe gambetta)"
au mois,"1,94 €",3,12,"0,00","(hotel au mois lyon, logement au mois lyon, appart hotel au mois lyon)"
chambres,"0,73 €",1,12,"0,00","(chambres d hôtes lyon, chambres d hotes lyon, chambres d hotes lyon et environs)"
dardilly,"0,00 €",0,12,"0,00","(hôtel dardilly, b&b dardilly, balladins dardilly)"
meininger,"0,00 €",0,12,"0,00","(meininger hotel lyon, meininger hotel lyon centre berthelot, meininger hotel lyon centre berthelot email)"
eurexpo,"0,00 €",0,12,"0,00","(hôtel chassieu eurexpo, airbnb eurexpo lyon, eurexpo lyon hotel)"
burger addict,"0,00 €",0,12,"0,00","(burger addict lyon menu, burger addict lyon 3 menu, menu de burger addict lyon 3)"
cote,"0,00 €",0,12,"0,00","(hotel a cote de la gare lyon part dieu, hotel lyon a cote de la gare, cote burger lyon)"
b,"0,00 €",0,11,"0,00","(b b hotel lyon aéroport saint exupéry, b b lyon, hotel b b lyon 9 rue antoine lumiere)"
saint exupéry,"0,00 €",0,11,"0,00","(b b hotel lyon aéroport saint exupéry, hotel pas cher aéroport lyon saint exupéry, ibis budget aéroport lyon saint exupéry colombier saugnieu)"
famille,"1,34 €",2,11,"0,00","(hotel lyon famille, nuit insolite lyon famille, hotel famille lyon)"
chateau,"0,66 €",1,11,"0,00","(relais chateau lyon, hotel relais chateau lyon, chateau d eau trevoux)"
resto,"0,87 €",1,11,"0,00",(resto burger lyon)
bill's burger,"0,82 €",1,11,"0,00","(bill's burger lyon 7, bill's burger lyon 6 menu, bill's burger lyon)"
day,"0,72 €",1,11,"0,00",(day use lyon)
tete d,"0,75 €",1,11,"0,00","(hotel la tete d or lyon, hotel parc de la tete d or, hotel parc tete d or lyon)"
beef,"0,85 €",1,11,"0,00","(smash and beef lyon 8, smash and beef menu, smash beef lyon 8)"
decines,"0,67 €",1,11,"0,00","(formule 1 decines charpieu, hotel decines charpieu, hotel pas cher decines charpieu)"
1er,"0,00 €",0,11,"0,00","(hotel lyon 1er arrondissement, 1er classe lyon, 1er classe lyon part dieu)"
adresse,"0,00 €",0,11,"0,00","(pilo lyon adresse, barlou burger lyon adresse, hotel marriott lyon adresse)"
charpieu,"0,67 €",1,11,"0,00","(formule 1 decines charpieu, hotel decines charpieu, hotel pas cher decines charpieu)"
pylo,"3,21 €",5,11,"0,00",(pylo lyon)
use,"0,72 €",1,11,"0,00",(day use lyon)
photos,"0,00 €",0,11,"0,00","(photos de pilo hôtel, pilo hôtel photos, photos de hôtel lyon métropole by arteloge)"
adagio lyon,"0,00 €",0,11,"0,00","(adagio lyon, hotel adagio lyon, adagio lyon centre)"
moin cher,"1,24 €",2,11,"0,00","(hotel moin cher lyon, hotel lyon moin cher, hotel le moin cher a lyon)"
étoiles,"0,00 €",0,11,"0,00","(hôtel 5 étoiles lyon, hotel 3 étoiles lyon, hôtel luxe lyon 5 étoiles)"
accor,"1,95 €",3,11,"0,00","(accor hotel lyon, accor hotel lyon centre, accor hotel lyon confluence)"
eklo,"0,00 €",0,10,"0,00","(hotel eklo lyon, eklo hotel lyon, eklo lyon hotel)"
brunch,"0,00 €",0,10,"0,00","(pilo hotel brunch, pilo lyon brunch, brunch hotel lyon)"
best western,"1,40 €",2,10,"0,00","(best western créqui lyon part dieu, best western 69, best western chassieu lyon)"
apparthotel lyon,"0,00 €",0,10,"0,00","(apparthotel lyon, apparthotel lyon centre)"
sejour,"0,00 €",0,10,"0,00","(sejour a lyon, centre international de sejour lyon, lyon sejour)"
away,"0,00 €",0,10,"0,00","(away hostel lyon, auberge away lyon, away hostel lyon 1)"
guillotière,"0,38 €",1,10,"0,00","(hotel lyon guillotière, auberge de jeunesse lyon guillotière, hotel guillotière lyon)"
chers,"2,50 €",4,10,"0,00","(hotel pas chers lyon, hôtels pas chers lyon, hotels pas chers a lyon)"
vacances,"1,37 €",2,10,"0,00","(centre de vacances lyon, village vacances lyon, hotel cheque vacances lyon)"
hostels,"0,00 €",0,10,"0,00","(hostels lyon, lyon hostels, gare de lyon hostels)"
